{
  "schema_version": 1,
  "date": "2026-07-11",
  "generated_at": "2026-07-12T08:13:29+00:00",
  "followee_count": 166,
  "item_count": 5,
  "kinds_included": [
    "star",
    "fork",
    "follow",
    "release",
    "created"
  ],
  "trending_available": false,
  "trending_source_date": null,
  "items": [
    {
      "id": "event:11660188218",
      "kind": "star",
      "text": "safedv starred JustVugg/colibri",
      "actor": "safedv",
      "actor_url": "https://github.com/safedv",
      "created_at": "2026-07-11T21:52:29Z",
      "repo": "JustVugg/colibri",
      "repo_url": "https://github.com/JustVugg/colibri",
      "target_user": null,
      "target_user_url": null,
      "html_url": "https://github.com/JustVugg/colibri",
      "payload": {},
      "time_precision": "exact",
      "signals": {
        "trending": false,
        "trending_front_page": false,
        "circle_count": 1
      }
    },
    {
      "id": "event:11653048127",
      "kind": "star",
      "text": "aleenzz starred youssefnoob003/SindriKit",
      "actor": "aleenzz",
      "actor_url": "https://github.com/aleenzz",
      "created_at": "2026-07-11T14:38:30Z",
      "repo": "youssefnoob003/SindriKit",
      "repo_url": "https://github.com/youssefnoob003/SindriKit",
      "target_user": null,
      "target_user_url": null,
      "html_url": "https://github.com/youssefnoob003/SindriKit",
      "payload": {},
      "time_precision": "exact",
      "signals": {
        "trending": false,
        "trending_front_page": false,
        "circle_count": 1
      }
    },
    {
      "id": "event:11650697060",
      "kind": "star",
      "text": "Garck3h starred gmeier909/bface-agent",
      "actor": "Garck3h",
      "actor_url": "https://github.com/Garck3h",
      "created_at": "2026-07-11T12:14:52Z",
      "repo": "gmeier909/bface-agent",
      "repo_url": "https://github.com/gmeier909/bface-agent",
      "target_user": null,
      "target_user_url": null,
      "html_url": "https://github.com/gmeier909/bface-agent",
      "payload": {},
      "time_precision": "exact",
      "signals": {
        "trending": false,
        "trending_front_page": false,
        "circle_count": 1
      }
    },
    {
      "id": "event:11644194578",
      "kind": "star",
      "text": "odzhan starred threatexpress/malleable-c2",
      "actor": "odzhan",
      "actor_url": "https://github.com/odzhan",
      "created_at": "2026-07-11T05:08:50Z",
      "repo": "threatexpress/malleable-c2",
      "repo_url": "https://github.com/threatexpress/malleable-c2",
      "target_user": null,
      "target_user_url": null,
      "html_url": "https://github.com/threatexpress/malleable-c2",
      "payload": {},
      "time_precision": "exact",
      "signals": {
        "trending": false,
        "trending_front_page": false,
        "circle_count": 1
      }
    },
    {
      "id": "event:11644191672",
      "kind": "star",
      "text": "odzhan starred Orange-Cyberdefense/p3-loader",
      "actor": "odzhan",
      "actor_url": "https://github.com/odzhan",
      "created_at": "2026-07-11T05:08:37Z",
      "repo": "Orange-Cyberdefense/p3-loader",
      "repo_url": "https://github.com/Orange-Cyberdefense/p3-loader",
      "target_user": null,
      "target_user_url": null,
      "html_url": "https://github.com/Orange-Cyberdefense/p3-loader",
      "payload": {},
      "time_precision": "exact",
      "signals": {
        "trending": false,
        "trending_front_page": false,
        "circle_count": 1
      }
    }
  ],
  "summary": {
    "by_kind": {
      "star": 5
    },
    "push_events_excluded": 88,
    "events_in_window": 99,
    "follows_in_window": 0
  }
}
